"No.","Time","Source","Destination","Protocol","Length","Info"
"1","0.000000000","10.0.2.15","172.217.166.68","TLSv1.2","188","Application Data"
"2","0.000348648","172.217.166.68","10.0.2.15","TCP","62","443  >  52340 [ACK] Seq=1 Ack=133 Win=65535 Len=0"
"3","0.086018195","172.217.166.68","10.0.2.15","TLSv1.2","224","Application Data"
"4","0.086208443","172.217.166.68","10.0.2.15","TLSv1.2","361","Application Data, Application Data, Application Data"
"5","0.086482220","10.0.2.15","172.217.166.68","TCP","56","52340  >  443 [ACK] Seq=133 Ack=474 Win=65535 Len=0"
"6","0.086597039","10.0.2.15","172.217.166.68","TLSv1.2","102","Application Data"
"7","0.086926132","172.217.166.68","10.0.2.15","TCP","62","443  >  52340 [ACK] Seq=474 Ack=179 Win=65535 Len=0"
"8","0.128985108","10.0.2.15","172.217.166.68","TLSv1.2","189","Application Data"
"9","0.129351356","172.217.166.68","10.0.2.15","TCP","62","443  >  52340 [ACK] Seq=474 Ack=312 Win=65535 Len=0"
"10","0.229325235","10.0.2.15","172.217.166.68","TLSv1.2","98","Application Data"
"11","0.229685896","172.217.166.68","10.0.2.15","TCP","62","443  >  52340 [ACK] Seq=474 Ack=354 Win=65535 Len=0"
"12","0.230966226","10.0.2.15","172.217.166.68","TLSv1.2","190","Application Data"
"13","0.231324651","172.217.166.68","10.0.2.15","TCP","62","443  >  52340 [ACK] Seq=474 Ack=488 Win=65535 Len=0"
"14","0.320521183","172.217.166.68","10.0.2.15","TLSv1.2","426","Application Data, Application Data, Application Data"
"15","0.320679863","172.217.166.68","10.0.2.15","TLSv1.2","102","Application Data"
"16","0.320958669","10.0.2.15","172.217.166.68","TCP","56","52340  >  443 [ACK] Seq=488 Ack=890 Win=65535 Len=0"
"17","0.321071812","10.0.2.15","172.217.166.68","TLSv1.2","102","Application Data"
"18","0.321448117","172.217.166.68","10.0.2.15","TCP","62","443  >  52340 [ACK] Seq=890 Ack=534 Win=65535 Len=0"
"19","0.342325072","10.0.2.15","172.217.166.68","TLSv1.2","191","Application Data"
"20","0.342650532","172.217.166.68","10.0.2.15","TCP","62","443  >  52340 [ACK] Seq=890 Ack=669 Win=65535 Len=0"
"21","0.428890823","172.217.166.68","10.0.2.15","TLSv1.2","362","Application Data, Application Data"
"22","0.428961502","172.217.166.68","10.0.2.15","TLSv1.2","140","Application Data, Application Data"
"23","0.429409883","10.0.2.15","172.217.166.68","TCP","56","52340  >  443 [ACK] Seq=669 Ack=1280 Win=65535 Len=0"
"24","0.429558226","10.0.2.15","172.217.166.68","TLSv1.2","102","Application Data"
"25","0.429839826","172.217.166.68","10.0.2.15","TCP","62","443  >  52340 [ACK] Seq=1280 Ack=715 Win=65535 Len=0"
"26","0.735660258","10.0.2.15","172.217.166.68","TLSv1.2","265","Application Data"
"27","0.736125401","172.217.166.68","10.0.2.15","TCP","62","443  >  52340 [ACK] Seq=1280 Ack=924 Win=65535 Len=0"
"28","0.855973315","172.217.166.68","10.0.2.15","TLSv1.2","1476","Application Data"
"29","0.856021366","172.217.166.68","10.0.2.15","TLSv1.2","514","Application Data"
"30","0.856080591","10.0.2.15","172.217.166.68","TCP","56","52340  >  443 [ACK] Seq=924 Ack=3158 Win=65535 Len=0"
"31","0.856161886","172.217.166.68","10.0.2.15","TCP","1476","443  >  52340 [ACK] Seq=3158 Ack=924 Win=65535 Len=1420 [TCP segment of a reassembled PDU]"
"32","0.856192896","172.217.166.68","10.0.2.15","TLSv1.2","1476","Application Data [TCP segment of a reassembled PDU]"
"33","0.856212172","10.0.2.15","172.217.166.68","TCP","56","52340  >  443 [ACK] Seq=924 Ack=5998 Win=65535 Len=0"
"34","0.856252959","172.217.166.68","10.0.2.15","TLSv1.2","76","Application Data"
"35","0.856420578","172.217.166.68","10.0.2.15","TCP","1476","443  >  52340 [ACK] Seq=6018 Ack=924 Win=65535 Len=1420 [TCP segment of a reassembled PDU]"
"36","0.856432591","10.0.2.15","172.217.166.68","TCP","56","52340  >  443 [ACK] Seq=924 Ack=7438 Win=65535 Len=0"
"37","0.856461924","172.217.166.68","10.0.2.15","TLSv1.2","1353","Application Data, Application Data, Application Data"
"38","0.900184800","10.0.2.15","172.217.166.68","TCP","56","52340  >  443 [ACK] Seq=924 Ack=8735 Win=65535 Len=0"
"39","0.920102136","172.217.166.68","10.0.2.15","TCP","1476","443  >  52340 [ACK] Seq=8735 Ack=924 Win=65535 Len=1420 [TCP segment of a reassembled PDU]"
"40","0.920140129","10.0.2.15","172.217.166.68","TCP","56","52340  >  443 [ACK] Seq=924 Ack=10155 Win=65535 Len=0"
"41","0.920216955","172.217.166.68","10.0.2.15","TLSv1.2","1476","Application Data [TCP segment of a reassembled PDU]"
"42","0.920234555","10.0.2.15","172.217.166.68","TCP","56","52340  >  443 [ACK] Seq=924 Ack=11575 Win=65535 Len=0"
"43","0.920259977","172.217.166.68","10.0.2.15","TLSv1.2","76","Application Data"
"44","0.920269475","10.0.2.15","172.217.166.68","TCP","56","52340  >  443 [ACK] Seq=924 Ack=11595 Win=65535 Len=0"
"45","0.920437094","172.217.166.68","10.0.2.15","TCP","1476","443  >  52340 [ACK] Seq=11595 Ack=924 Win=65535 Len=1420 [TCP segment of a reassembled PDU]"
"46","0.920449945","10.0.2.15","172.217.166.68","TCP","56","52340  >  443 [ACK] Seq=924 Ack=13015 Win=65535 Len=0"
"47","0.920478720","172.217.166.68","10.0.2.15","TLSv1.2","1476","Application Data [TCP segment of a reassembled PDU]"
"48","0.920489056","10.0.2.15","172.217.166.68","TCP","56","52340  >  443 [ACK] Seq=924 Ack=14435 Win=65535 Len=0"
"49","0.920511126","172.217.166.68","10.0.2.15","TLSv1.2","1476","Application Data [TCP segment of a reassembled PDU]"
"50","0.920518110","172.217.166.68","10.0.2.15","TLSv1.2","86","Application Data"
"51","0.920567279","10.0.2.15","172.217.166.68","TCP","56","52340  >  443 [ACK] Seq=924 Ack=15855 Win=65535 Len=0"
"52","0.920828485","172.217.166.68","10.0.2.15","TCP","1476","443  >  52340 [ACK] Seq=15885 Ack=924 Win=65535 Len=1420 [TCP segment of a reassembled PDU]"
"53","0.920836587","172.217.166.68","10.0.2.15","TLSv1.2","66","Application Data"
"54","0.921005323","172.217.166.68","10.0.2.15","TCP","1476","443  >  52340 [ACK] Seq=17315 Ack=924 Win=65535 Len=1420 [TCP segment of a reassembled PDU]"
"55","0.921010631","172.217.166.68","10.0.2.15","TLSv1.2","66","Application Data"
"56","0.921128244","10.0.2.15","172.217.166.68","TCP","56","52340  >  443 [ACK] Seq=924 Ack=15885 Win=65535 Len=0"
"57","0.921182999","10.0.2.15","172.217.166.68","TCP","56","52340  >  443 [ACK] Seq=924 Ack=17305 Win=65535 Len=0"
"58","0.921226022","10.0.2.15","172.217.166.68","TCP","56","52340  >  443 [ACK] Seq=924 Ack=17315 Win=65535 Len=0"
"59","0.921264853","10.0.2.15","172.217.166.68","TCP","56","52340  >  443 [ACK] Seq=924 Ack=18735 Win=65535 Len=0"
"60","0.921268764","172.217.166.68","10.0.2.15","TCP","1476","443  >  52340 [ACK] Seq=18745 Ack=924 Win=65535 Len=1420 [TCP segment of a reassembled PDU]"
"61","0.921276307","172.217.166.68","10.0.2.15","TLSv1.2","66","Application Data"
"62","0.921306758","10.0.2.15","172.217.166.68","TCP","56","52340  >  443 [ACK] Seq=924 Ack=18745 Win=65535 Len=0"
"63","0.921360676","10.0.2.15","172.217.166.68","TCP","56","52340  >  443 [ACK] Seq=924 Ack=20165 Win=65535 Len=0"
"64","0.921537234","10.0.2.15","172.217.166.68","TCP","56","52340  >  443 [ACK] Seq=924 Ack=20175 Win=65535 Len=0"
"65","0.922180612","172.217.166.68","10.0.2.15","TCP","1476","443  >  52340 [ACK] Seq=20175 Ack=924 Win=65535 Len=1420 [TCP segment of a reassembled PDU]"
"66","0.922202682","172.217.166.68","10.0.2.15","TLSv1.2","1476","Application Data [TCP segment of a reassembled PDU]"
"67","0.922212739","10.0.2.15","172.217.166.68","TCP","56","52340  >  443 [ACK] Seq=924 Ack=23015 Win=65535 Len=0"
"68","0.922240117","172.217.166.68","10.0.2.15","TLSv1.2","1476","Application Data [TCP segment of a reassembled PDU]"
"69","0.922249895","172.217.166.68","10.0.2.15","TLSv1.2","1091","Application Data, Application Data"
"70","0.922257717","10.0.2.15","172.217.166.68","TCP","56","52340  >  443 [ACK] Seq=924 Ack=25470 Win=65535 Len=0"
"71","0.929896677","172.217.166.68","10.0.2.15","TCP","1476","443  >  52340 [ACK] Seq=25470 Ack=924 Win=65535 Len=1420 [TCP segment of a reassembled PDU]"
"72","0.929921261","172.217.166.68","10.0.2.15","TLSv1.2","66","Application Data"
"73","0.929934391","10.0.2.15","172.217.166.68","TCP","56","52340  >  443 [ACK] Seq=924 Ack=26900 Win=65535 Len=0"
"74","0.930707953","172.217.166.68","10.0.2.15","TCP","1476","443  >  52340 [ACK] Seq=26900 Ack=924 Win=65535 Len=1420 [TCP segment of a reassembled PDU]"
"75","0.930721921","172.217.166.68","10.0.2.15","TLSv1.2","66","Application Data"
"76","0.930933680","172.217.166.68","10.0.2.15","TCP","1476","443  >  52340 [ACK] Seq=28330 Ack=924 Win=65535 Len=1420 [TCP segment of a reassembled PDU]"
"77","0.930942899","172.217.166.68","10.0.2.15","TLSv1.2","510","Application Data, Application Data"
"78","0.932369896","10.0.2.15","172.217.166.68","TCP","56","52340  >  443 [ACK] Seq=924 Ack=30204 Win=65535 Len=0"
"79","0.958092998","127.0.0.1","127.0.0.53","DNS","82","Standard query 0x67f9 A fonts.googleapis.com"
"80","0.958132388","127.0.0.1","127.0.0.53","DNS","82","Standard query 0x2825 AAAA fonts.googleapis.com"
"81","0.958373201","10.0.2.15","1.0.0.1","DNS","93","Standard query 0xd661 A fonts.googleapis.com OPT"
"82","0.958605633","10.0.2.15","1.0.0.1","DNS","93","Standard query 0x3e95 AAAA fonts.googleapis.com OPT"
"83","0.966007970","1.0.0.1","10.0.2.15","DNS","157","Standard query response 0x3e95 AAAA fonts.googleapis.com CNAME googleadapis.l.google.com AAAA 2404:6800:4009:80d::200a OPT"
"84","0.966282586","127.0.0.53","127.0.0.1","DNS","146","Standard query response 0x2825 AAAA fonts.googleapis.com CNAME googleadapis.l.google.com AAAA 2404:6800:4009:80d::200a"
"85","0.971063361","1.0.0.1","10.0.2.15","DNS","145","Standard query response 0xd661 A fonts.googleapis.com CNAME googleadapis.l.google.com A 172.217.166.74 OPT"
"86","0.971365076","127.0.0.53","127.0.0.1","DNS","134","Standard query response 0x67f9 A fonts.googleapis.com CNAME googleadapis.l.google.com A 172.217.166.74"
"87","0.971795018","10.0.2.15","172.217.166.74","TCP","76","34760  >  443 [SYN] Seq=0 Win=29200 Len=0 MSS=1460 SACK_PERM=1 TSval=1550880774 TSecr=0 WS=128"
"88","0.977260797","172.217.166.74","10.0.2.15","TCP","62","443  >  34760 [SYN, ACK] Seq=0 Ack=1 Win=65535 Len=0 MSS=1460"
"89","0.977330359","10.0.2.15","172.217.166.74","TCP","56","34760  >  443 [ACK] Seq=1 Ack=1 Win=29200 Len=0"
"90","0.978905140","10.0.2.15","172.217.166.74","TLSv1.2","573","Client Hello"
"91","0.979155172","172.217.166.74","10.0.2.15","TCP","62","443  >  34760 [ACK] Seq=1 Ack=518 Win=65535 Len=0"
"92","1.045089250","172.217.166.74","10.0.2.15","TLSv1.2","1476","Server Hello"
"93","1.045152945","10.0.2.15","172.217.166.74","TCP","56","34760  >  443 [ACK] Seq=518 Ack=1421 Win=31240 Len=0"
"94","1.045339282","172.217.166.74","10.0.2.15","TCP","66","443  >  34760 [PSH, ACK] Seq=1421 Ack=518 Win=65535 Len=10 [TCP segment of a reassembled PDU]"
"95","1.045360234","10.0.2.15","172.217.166.74","TCP","56","34760  >  443 [ACK] Seq=518 Ack=1431 Win=31240 Len=0"
"96","1.045402977","172.217.166.74","10.0.2.15","TLSv1.2","1035","Certificate, Server Key Exchange, Server Hello Done"
"97","1.045414431","10.0.2.15","172.217.166.74","TCP","56","34760  >  443 [ACK] Seq=518 Ack=2410 Win=34080 Len=0"
"98","1.050254711","10.0.2.15","172.217.166.74","TLSv1.2","149","Client Key Exchange, Change Cipher Spec, Encrypted Handshake Message"
"99","1.050884959","172.217.166.74","10.0.2.15","TCP","62","443  >  34760 [ACK] Seq=2410 Ack=611 Win=65535 Len=0"
"100","1.053933111","10.0.2.15","172.217.166.78","OCSP","491","Request"
"101","1.054525365","172.217.166.78","10.0.2.15","TCP","62","80  >  36866 [ACK] Seq=1 Ack=436 Win=65535 Len=0"
"102","1.054934356","172.217.166.74","10.0.2.15","TLSv1.2","340","New Session Ticket, Change Cipher Spec, Encrypted Handshake Message"
"103","1.055135219","172.217.166.74","10.0.2.15","TLSv1.2","125","Application Data"
"104","1.096206361","10.0.2.15","172.217.166.74","TCP","56","34760  >  443 [ACK] Seq=611 Ack=2763 Win=36920 Len=0"
"105","1.119639228","172.217.166.78","10.0.2.15","OCSP","761","Response"
"106","1.119712142","10.0.2.15","172.217.166.78","TCP","56","36866  >  80 [ACK] Seq=436 Ack=706 Win=31725 Len=0"
"107","1.121796764","10.0.2.15","172.217.166.74","TLSv1.2","233","Application Data"
"108","1.121954606","10.0.2.15","172.217.166.74","TLSv1.2","283","Application Data"
"109","1.122175025","172.217.166.74","10.0.2.15","TCP","62","443  >  34760 [ACK] Seq=2763 Ack=788 Win=65535 Len=0"
"110","1.122192904","172.217.166.74","10.0.2.15","TCP","62","443  >  34760 [ACK] Seq=2763 Ack=1015 Win=65535 Len=0"
"111","1.122452993","10.0.2.15","172.217.166.74","TLSv1.2","94","Application Data"
"112","1.122709730","172.217.166.74","10.0.2.15","TCP","62","443  >  34760 [ACK] Seq=2763 Ack=1053 Win=65535 Len=0"
"113","1.126111559","172.217.166.74","10.0.2.15","TLSv1.2","94","Application Data"
"114","1.126128321","10.0.2.15","172.217.166.74","TCP","56","34760  >  443 [ACK] Seq=1053 Ack=2801 Win=36920 Len=0"
"115","1.195132342","172.217.166.74","10.0.2.15","TLSv1.2","361","Application Data"
"116","1.195176202","10.0.2.15","172.217.166.74","TCP","56","34760  >  443 [ACK] Seq=1053 Ack=3106 Win=39760 Len=0"
"117","1.195399415","172.217.166.74","10.0.2.15","TLSv1.2","861","Application Data, Application Data, Application Data, Application Data"
"118","1.195414780","10.0.2.15","172.217.166.74","TCP","56","34760  >  443 [ACK] Seq=1053 Ack=3911 Win=42600 Len=0"
"119","1.195907580","10.0.2.15","172.217.166.74","TLSv1.2","102","Application Data"
"120","1.196209015","172.217.166.74","10.0.2.15","TCP","62","443  >  34760 [ACK] Seq=3911 Ack=1099 Win=65535 Len=0"
"121","1.294217002","172.217.166.68","10.0.2.15","TCP","1476","443  >  52340 [ACK] Seq=30204 Ack=924 Win=65535 Len=1420 [TCP segment of a reassembled PDU]"
"122","1.294263097","10.0.2.15","172.217.166.68","TCP","56","52340  >  443 [ACK] Seq=924 Ack=31624 Win=65535 Len=0"
"123","1.294299974","172.217.166.68","10.0.2.15","TLSv1.2","1476","Application Data [TCP segment of a reassembled PDU]"
"124","1.294312545","10.0.2.15","172.217.166.68","TCP","56","52340  >  443 [ACK] Seq=924 Ack=33044 Win=65535 Len=0"
"125","1.294334336","172.217.166.68","10.0.2.15","TLSv1.2","76","Application Data"
"126","1.294344113","10.0.2.15","172.217.166.68","TCP","56","52340  >  443 [ACK] Seq=924 Ack=33064 Win=65535 Len=0"
"127","1.294446361","172.217.166.68","10.0.2.15","TLSv1.2","1431","Application Data"
"128","1.294455580","10.0.2.15","172.217.166.68","TCP","56","52340  >  443 [ACK] Seq=924 Ack=34439 Win=65535 Len=0"
"129","1.295065713","172.217.166.68","10.0.2.15","TLSv1.2","822","Application Data"
"130","1.295075771","10.0.2.15","172.217.166.68","TCP","56","52340  >  443 [ACK] Seq=924 Ack=35205 Win=65535 Len=0"
"131","1.302680089","172.217.166.68","10.0.2.15","TCP","1476","443  >  52340 [ACK] Seq=35205 Ack=924 Win=65535 Len=1420 [TCP segment of a reassembled PDU]"
"132","1.302703276","10.0.2.15","172.217.166.68","TCP","56","52340  >  443 [ACK] Seq=924 Ack=36625 Win=65535 Len=0"
"133","1.302741829","172.217.166.68","10.0.2.15","TLSv1.2","66","Application Data"
"134","1.302749930","10.0.2.15","172.217.166.68","TCP","56","52340  >  443 [ACK] Seq=924 Ack=36635 Win=65535 Len=0"
"135","1.302906375","172.217.166.68","10.0.2.15","TCP","1476","443  >  52340 [ACK] Seq=36635 Ack=924 Win=65535 Len=1420 [TCP segment of a reassembled PDU]"
"136","1.302915594","10.0.2.15","172.217.166.68","TCP","56","52340  >  443 [ACK] Seq=924 Ack=38055 Win=65535 Len=0"
"137","1.302938502","172.217.166.68","10.0.2.15","TLSv1.2","1476","Application Data [TCP segment of a reassembled PDU]"
"138","1.302946883","10.0.2.15","172.217.166.68","TCP","56","52340  >  443 [ACK] Seq=924 Ack=39475 Win=65535 Len=0"
"139","1.302966718","172.217.166.68","10.0.2.15","TLSv1.2","1476","Application Data [TCP segment of a reassembled PDU]"
"140","1.302977054","10.0.2.15","172.217.166.68","TCP","56","52340  >  443 [ACK] Seq=924 Ack=40895 Win=65535 Len=0"
"141","1.302996330","172.217.166.68","10.0.2.15","TLSv1.2","86","Application Data"
"142","1.303004153","10.0.2.15","172.217.166.68","TCP","56","52340  >  443 [ACK] Seq=924 Ack=40925 Win=65535 Len=0"
"143","1.303749219","172.217.166.68","10.0.2.15","TCP","1476","443  >  52340 [ACK] Seq=40925 Ack=924 Win=65535 Len=1420 [TCP segment of a reassembled PDU]"
"144","1.303759835","10.0.2.15","172.217.166.68","TCP","56","52340  >  443 [ACK] Seq=924 Ack=42345 Win=65535 Len=0"
"145","1.303799505","172.217.166.68","10.0.2.15","TLSv1.2","66","Application Data"
"146","1.303807886","10.0.2.15","172.217.166.68","TCP","56","52340  >  443 [ACK] Seq=924 Ack=42355 Win=65535 Len=0"
"147","1.304092280","172.217.166.68","10.0.2.15","TCP","1476","443  >  52340 [ACK] Seq=42355 Ack=924 Win=65535 Len=1420 [TCP segment of a reassembled PDU]"
"148","1.304112115","10.0.2.15","172.217.166.68","TCP","56","52340  >  443 [ACK] Seq=924 Ack=43775 Win=65535 Len=0"
"149","1.304140330","172.217.166.68","10.0.2.15","TLSv1.2","1476","Application Data [TCP segment of a reassembled PDU]"
"150","1.304151505","10.0.2.15","172.217.166.68","TCP","56","52340  >  443 [ACK] Seq=924 Ack=45195 Win=65535 Len=0"
"151","1.304180559","172.217.166.68","10.0.2.15","TLSv1.2","1476","Application Data [TCP segment of a reassembled PDU]"
"152","1.304190896","10.0.2.15","172.217.166.68","TCP","56","52340  >  443 [ACK] Seq=924 Ack=46615 Win=65535 Len=0"
"153","1.304216038","172.217.166.68","10.0.2.15","TLSv1.2","1476","Application Data [TCP segment of a reassembled PDU]"
"154","1.304226375","172.217.166.68","10.0.2.15","TLSv1.2","1476","Application Data [TCP segment of a reassembled PDU]"
"155","1.304234476","10.0.2.15","172.217.166.68","TCP","56","52340  >  443 [ACK] Seq=924 Ack=49455 Win=65535 Len=0"
"156","1.304256267","172.217.166.68","10.0.2.15","TLSv1.2","210","Application Data, Application Data"
"157","1.304509930","10.0.2.15","172.217.166.68","TCP","56","52340  >  443 [ACK] Seq=924 Ack=49609 Win=65535 Len=0"
"158","1.361557684","172.217.166.68","10.0.2.15","TCP","1476","443  >  52340 [ACK] Seq=49609 Ack=924 Win=65535 Len=1420 [TCP segment of a reassembled PDU]"
"159","1.361593722","172.217.166.68","10.0.2.15","TLSv1.2","66","Application Data"
"160","1.361668592","10.0.2.15","172.217.166.68","TCP","56","52340  >  443 [ACK] Seq=924 Ack=51039 Win=65535 Len=0"
"161","1.361990141","172.217.166.68","10.0.2.15","TCP","1476","443  >  52340 [ACK] Seq=51039 Ack=924 Win=65535 Len=1420 [TCP segment of a reassembled PDU]"
"162","1.362012490","172.217.166.68","10.0.2.15","TLSv1.2","1476","Application Data [TCP segment of a reassembled PDU]"
"163","1.362024503","10.0.2.15","172.217.166.68","TCP","56","52340  >  443 [ACK] Seq=924 Ack=53879 Win=65535 Len=0"
"164","1.362054395","172.217.166.68","10.0.2.15","TLSv1.2","1476","Application Data [TCP segment of a reassembled PDU]"
"165","1.362065011","172.217.166.68","10.0.2.15","TLSv1.2","86","Application Data"
"166","1.362073671","10.0.2.15","172.217.166.68","TCP","56","52340  >  443 [ACK] Seq=924 Ack=55329 Win=65535 Len=0"
"167","1.362229278","172.217.166.68","10.0.2.15","TCP","1476","443  >  52340 [ACK] Seq=55329 Ack=924 Win=65535 Len=1420 [TCP segment of a reassembled PDU]"
"168","1.362235982","172.217.166.68","10.0.2.15","TLSv1.2","66","Application Data"
"169","1.362314763","10.0.2.15","172.217.166.68","TCP","56","52340  >  443 [ACK] Seq=924 Ack=56759 Win=65535 Len=0"
"170","1.362654471","172.217.166.68","10.0.2.15","TCP","1476","443  >  52340 [ACK] Seq=56759 Ack=924 Win=65535 Len=1420 [TCP segment of a reassembled PDU]"
"171","1.362678217","172.217.166.68","10.0.2.15","TLSv1.2","1476","Application Data [TCP segment of a reassembled PDU]"
"172","1.362690230","10.0.2.15","172.217.166.68","TCP","56","52340  >  443 [ACK] Seq=924 Ack=59599 Win=65535 Len=0"
"173","1.362712859","172.217.166.68","10.0.2.15","TLSv1.2","76","Application Data"
"174","1.362905900","172.217.166.68","10.0.2.15","TCP","1476","443  >  52340 [ACK] Seq=59619 Ack=924 Win=65535 Len=1420 [TCP segment of a reassembled PDU]"
"175","1.362917633","10.0.2.15","172.217.166.68","TCP","56","52340  >  443 [ACK] Seq=924 Ack=61039 Win=65535 Len=0"
"176","1.362947805","172.217.166.68","10.0.2.15","TLSv1.2","1476","Application Data [TCP segment of a reassembled PDU]"
"177","1.362957303","172.217.166.68","10.0.2.15","TLSv1.2","76","Application Data"
"178","1.362965684","10.0.2.15","172.217.166.68","TCP","56","52340  >  443 [ACK] Seq=924 Ack=62479 Win=65535 Len=0"
"179","1.363410154","172.217.166.68","10.0.2.15","TCP","1476","443  >  52340 [ACK] Seq=62479 Ack=924 Win=65535 Len=1420 [TCP segment of a reassembled PDU]"
"180","1.363423005","172.217.166.68","10.0.2.15","TLSv1.2","66","Application Data"
"181","1.363431665","10.0.2.15","172.217.166.68","TCP","56","52340  >  443 [ACK] Seq=924 Ack=63909 Win=65535 Len=0"
"182","1.363579449","172.217.166.68","10.0.2.15","TCP","1476","443  >  52340 [ACK] Seq=63909 Ack=924 Win=65535 Len=1420 [TCP segment of a reassembled PDU]"
"183","1.363590903","172.217.166.68","10.0.2.15","TLSv1.2","649","Application Data, Application Data"
"184","1.364552198","10.0.2.15","172.217.166.68","TCP","56","52340  >  443 [ACK] Seq=924 Ack=65922 Win=65535 Len=0"
"185","1.380168150","172.217.166.68","10.0.2.15","TCP","1476","443  >  52340 [ACK] Seq=65922 Ack=924 Win=65535 Len=1420 [TCP segment of a reassembled PDU]"
"186","1.380198880","172.217.166.68","10.0.2.15","TLSv1.2","66","Application Data"
"187","1.380216759","10.0.2.15","172.217.166.68","TCP","56","52340  >  443 [ACK] Seq=924 Ack=67352 Win=65535 Len=0"
"188","1.380408404","172.217.166.68","10.0.2.15","TCP","1476","443  >  52340 [ACK] Seq=67352 Ack=924 Win=65535 Len=1420 [TCP segment of a reassembled PDU]"
"189","1.380420696","172.217.166.68","10.0.2.15","TLSv1.2","1476","Application Data [TCP segment of a reassembled PDU]"
"190","1.380432150","10.0.2.15","172.217.166.68","TCP","56","52340  >  443 [ACK] Seq=924 Ack=70192 Win=65535 Len=0"
"191","1.380464835","172.217.166.68","10.0.2.15","TLSv1.2","1476","Application Data [TCP segment of a reassembled PDU]"
"192","1.380476010","172.217.166.68","10.0.2.15","TLSv1.2","86","Application Data"
"193","1.380486626","10.0.2.15","172.217.166.68","TCP","56","52340  >  443 [ACK] Seq=924 Ack=71642 Win=65535 Len=0"
"194","1.380833597","172.217.166.68","10.0.2.15","TCP","1476","443  >  52340 [ACK] Seq=71642 Ack=924 Win=65535 Len=1420 [TCP segment of a reassembled PDU]"
"195","1.380843375","172.217.166.68","10.0.2.15","TLSv1.2","66","Application Data"
"196","1.380870194","10.0.2.15","172.217.166.68","TCP","56","52340  >  443 [ACK] Seq=924 Ack=73072 Win=65535 Len=0"
"197","1.381669178","172.217.166.68","10.0.2.15","TCP","1476","443  >  52340 [ACK] Seq=73072 Ack=924 Win=65535 Len=1420 [TCP segment of a reassembled PDU]"
"198","1.381713039","172.217.166.68","10.0.2.15","TLSv1.2","66","Application Data"
"199","1.381724772","10.0.2.15","172.217.166.68","TCP","56","52340  >  443 [ACK] Seq=924 Ack=74502 Win=65535 Len=0"
"200","1.381980112","172.217.166.68","10.0.2.15","TCP","1476","443  >  52340 [ACK] Seq=74502 Ack=924 Win=65535 Len=1420 [TCP segment of a reassembled PDU]"
"201","1.382017547","172.217.166.68","10.0.2.15","TLSv1.2","1476","Application Data [TCP segment of a reassembled PDU]"
"202","1.382029280","10.0.2.15","172.217.166.68","TCP","56","52340  >  443 [ACK] Seq=924 Ack=77342 Win=65535 Len=0"
"203","1.382063642","172.217.166.68","10.0.2.15","TLSv1.2","1476","Application Data [TCP segment of a reassembled PDU]"
"204","1.382075934","172.217.166.68","10.0.2.15","TLSv1.2","1476","Application Data [TCP segment of a reassembled PDU]"
"205","1.382089064","10.0.2.15","172.217.166.68","TCP","56","52340  >  443 [ACK] Seq=924 Ack=80182 Win=65535 Len=0"
"206","1.382119515","172.217.166.68","10.0.2.15","TLSv1.2","1476","Application Data [TCP segment of a reassembled PDU]"
"207","1.382132924","172.217.166.68","10.0.2.15","TLSv1.2","1155","Application Data, Application Data, Application Data"
"208","1.382144378","10.0.2.15","172.217.166.68","TCP","56","52340  >  443 [ACK] Seq=924 Ack=82701 Win=65535 Len=0"
"209","1.388229509","172.217.166.68","10.0.2.15","TCP","1476","443  >  52340 [ACK] Seq=82701 Ack=924 Win=65535 Len=1420 [TCP segment of a reassembled PDU]"
"210","1.388261357","172.217.166.68","10.0.2.15","TLSv1.2","66","Application Data"
"211","1.388276443","10.0.2.15","172.217.166.68","TCP","56","52340  >  443 [ACK] Seq=924 Ack=84131 Win=65535 Len=0"
"212","1.388322538","172.217.166.68","10.0.2.15","TCP","1476","443  >  52340 [ACK] Seq=84131 Ack=924 Win=65535 Len=1420 [TCP segment of a reassembled PDU]"
"213","1.388333992","172.217.166.68","10.0.2.15","TLSv1.2","1476","Application Data [TCP segment of a reassembled PDU]"
"214","1.388345167","10.0.2.15","172.217.166.68","TCP","56","52340  >  443 [ACK] Seq=924 Ack=86971 Win=65535 Len=0"
"215","1.388373941","172.217.166.68","10.0.2.15","TLSv1.2","76","Application Data"
"216","1.389103363","172.217.166.68","10.0.2.15","TCP","1476","443  >  52340 [ACK] Seq=86991 Ack=924 Win=65535 Len=1420 [TCP segment of a reassembled PDU]"
"217","1.389144709","10.0.2.15","172.217.166.68","TCP","56","52340  >  443 [ACK] Seq=924 Ack=88411 Win=65535 Len=0"
"218","1.389187452","172.217.166.68","10.0.2.15","TLSv1.2","1476","Application Data [TCP segment of a reassembled PDU]"
"219","1.389212036","172.217.166.68","10.0.2.15","TLSv1.2","1476","Application Data [TCP segment of a reassembled PDU]"
"220","1.389236062","10.0.2.15","172.217.166.68","TCP","56","52340  >  443 [ACK] Seq=924 Ack=91251 Win=65535 Len=0"
"221","1.389309256","172.217.166.68","10.0.2.15","TLSv1.2","1194","Application Data, Application Data"
"222","1.390156291","10.0.2.15","172.217.166.68","TCP","56","52340  >  443 [ACK] Seq=924 Ack=92389 Win=65535 Len=0"
"223","1.395208050","172.217.166.68","10.0.2.15","TCP","1476","443  >  52340 [ACK] Seq=92389 Ack=924 Win=65535 Len=1420 [TCP segment of a reassembled PDU]"
"224","1.395256101","172.217.166.68","10.0.2.15","TLSv1.2","66","Application Data"
"225","1.395277332","10.0.2.15","172.217.166.68","TCP","56","52340  >  443 [ACK] Seq=924 Ack=93819 Win=65535 Len=0"
"226","1.395317840","172.217.166.68","10.0.2.15","TCP","1476","443  >  52340 [ACK] Seq=93819 Ack=924 Win=65535 Len=1420 [TCP segment of a reassembled PDU]"
"227","1.395368406","172.217.166.68","10.0.2.15","TLSv1.2","1476","Application Data [TCP segment of a reassembled PDU]"
"228","1.395381815","10.0.2.15","172.217.166.68","TCP","56","52340  >  443 [ACK] Seq=924 Ack=96659 Win=65535 Len=0"
"229","1.395414221","172.217.166.68","10.0.2.15","TLSv1.2","76","Application Data"
"230","1.396214044","172.217.166.68","10.0.2.15","TCP","1476","443  >  52340 [ACK] Seq=96679 Ack=924 Win=65535 Len=1420 [TCP segment of a reassembled PDU]"
"231","1.396233041","10.0.2.15","172.217.166.68","TCP","56","52340  >  443 [ACK] Seq=924 Ack=98099 Win=65535 Len=0"
"232","1.396274666","172.217.166.68","10.0.2.15","TLSv1.2","66","Application Data"
"233","1.397061079","172.217.166.68","10.0.2.15","TLSv1.2","1398","Application Data"
"234","1.401720889","10.0.2.15","172.217.166.68","TCP","56","52340  >  443 [ACK] Seq=924 Ack=99451 Win=65535 Len=0"
"235","1.425375851","172.217.166.68","10.0.2.15","TCP","1476","443  >  52340 [ACK] Seq=99451 Ack=924 Win=65535 Len=1420 [TCP segment of a reassembled PDU]"
"236","1.425416359","172.217.166.68","10.0.2.15","TLSv1.2","1476","Application Data [TCP segment of a reassembled PDU]"
"237","1.425433400","10.0.2.15","172.217.166.68","TCP","56","52340  >  443 [ACK] Seq=924 Ack=102291 Win=65535 Len=0"
"238","1.425476422","172.217.166.68","10.0.2.15","TLSv1.2","76","Application Data"
"239","1.425596828","172.217.166.68","10.0.2.15","TCP","1476","443  >  52340 [ACK] Seq=102311 Ack=924 Win=65535 Len=1420 [TCP segment of a reassembled PDU]"
"240","1.425609679","10.0.2.15","172.217.166.68","TCP","56","52340  >  443 [ACK] Seq=924 Ack=103731 Win=65535 Len=0"
"241","1.425639013","172.217.166.68","10.0.2.15","TLSv1.2","66","Application Data"
"242","1.427283635","172.217.166.68","10.0.2.15","TCP","1476","443  >  52340 [ACK] Seq=103741 Ack=924 Win=65535 Len=1420 [TCP segment of a reassembled PDU]"
"243","1.427301235","10.0.2.15","172.217.166.68","TCP","56","52340  >  443 [ACK] Seq=924 Ack=105161 Win=65535 Len=0"
"244","1.427334200","172.217.166.68","10.0.2.15","TLSv1.2","1476","Application Data [TCP segment of a reassembled PDU]"
"245","1.427344257","172.217.166.68","10.0.2.15","TLSv1.2","1476","Application Data [TCP segment of a reassembled PDU]"
"246","1.427352359","172.217.166.68","10.0.2.15","TLSv1.2","1476","Application Data [TCP segment of a reassembled PDU]"
"247","1.427359902","172.217.166.68","10.0.2.15","TLSv1.2","1476","Application Data [TCP segment of a reassembled PDU]"
"248","1.427369121","172.217.166.68","10.0.2.15","TLSv1.2","1476","Application Data [TCP segment of a reassembled PDU]"
"249","1.427376384","172.217.166.68","10.0.2.15","TLSv1.2","116","Application Data"
"250","1.427500143","172.217.166.68","10.0.2.15","TCP","1476","443  >  52340 [ACK] Seq=112321 Ack=924 Win=65535 Len=1420 [TCP segment of a reassembled PDU]"
"251","1.427510759","172.217.166.68","10.0.2.15","TLSv1.2","1476","Application Data [TCP segment of a reassembled PDU]"
"252","1.427518022","172.217.166.68","10.0.2.15","TLSv1.2","1476","Application Data [TCP segment of a reassembled PDU]"
"253","1.427525006","172.217.166.68","10.0.2.15","TLSv1.2","1476","Application Data [TCP segment of a reassembled PDU]"
"254","1.427531711","172.217.166.68","10.0.2.15","TLSv1.2","1476","Application Data [TCP segment of a reassembled PDU]"
"255","1.427539533","172.217.166.68","10.0.2.15","TLSv1.2","106","Application Data"
"256","1.428153578","172.217.166.68","10.0.2.15","TCP","1476","443  >  52340 [ACK] Seq=119471 Ack=924 Win=65535 Len=1420 [TCP segment of a reassembled PDU]"
"257","1.428166708","172.217.166.68","10.0.2.15","TLSv1.2","66","Application Data"
"258","1.428183470","10.0.2.15","172.217.166.68","TCP","56","52340  >  443 [ACK] Seq=924 Ack=120891 Win=65535 Len=0"
"259","1.428383495","172.217.166.68","10.0.2.15","TCP","1476","443  >  52340 [ACK] Seq=120901 Ack=924 Win=65535 Len=1420 [TCP segment of a reassembled PDU]"
"260","1.428397464","172.217.166.68","10.0.2.15","TLSv1.2","1476","Application Data [TCP segment of a reassembled PDU]"
"261","1.428401375","10.0.2.15","172.217.166.68","TCP","56","52340  >  443 [ACK] Seq=924 Ack=122321 Win=65535 Len=0"
"262","1.428406683","172.217.166.68","10.0.2.15","TLSv1.2","1476","Application Data [TCP segment of a reassembled PDU]"
"263","1.428412829","172.217.166.68","10.0.2.15","TLSv1.2","1476","Application Data [TCP segment of a reassembled PDU]"
"264","1.428418416","172.217.166.68","10.0.2.15","TLSv1.2","1476","Application Data [TCP segment of a reassembled PDU]"
"265","1.428424003","172.217.166.68","10.0.2.15","TLSv1.2","106","Application Data"
"266","1.428450822","10.0.2.15","172.217.166.68","TCP","56","52340  >  443 [ACK] Seq=924 Ack=128051 Win=65535 Len=0"
"267","1.429122416","172.217.166.68","10.0.2.15","TCP","1476","443  >  52340 [ACK] Seq=128051 Ack=924 Win=65535 Len=1420 [TCP segment of a reassembled PDU]"
"268","1.429152029","172.217.166.68","10.0.2.15","TLSv1.2","66","Application Data"
"269","1.429166276","10.0.2.15","172.217.166.68","TCP","56","52340  >  443 [ACK] Seq=924 Ack=129481 Win=65535 Len=0"
"270","1.429311267","172.217.166.68","10.0.2.15","TCP","1476","443  >  52340 [ACK] Seq=129481 Ack=924 Win=65535 Len=1420 [TCP segment of a reassembled PDU]"
"271","1.429321324","172.217.166.68","10.0.2.15","TLSv1.2","1476","Application Data [TCP segment of a reassembled PDU]"
"272","1.429330823","10.0.2.15","172.217.166.68","TCP","56","52340  >  443 [ACK] Seq=924 Ack=132321 Win=65535 Len=0"
"273","1.429354569","172.217.166.68","10.0.2.15","TLSv1.2","1476","Application Data, Application Data, Application Data"
"274","1.429362950","172.217.166.68","10.0.2.15","TLSv1.2","716","Application Data"
"275","1.429370213","10.0.2.15","172.217.166.68","TCP","56","52340  >  443 [ACK] Seq=924 Ack=134401 Win=65535 Len=0"
"276","1.430088740","172.217.166.68","10.0.2.15","TCP","1476","443  >  52340 [ACK] Seq=134401 Ack=924 Win=65535 Len=1420 [TCP segment of a reassembled PDU]"
"277","1.430102150","172.217.166.68","10.0.2.15","TLSv1.2","66","Application Data"
"278","1.430112207","10.0.2.15","172.217.166.68","TCP","56","52340  >  443 [ACK] Seq=924 Ack=135831 Win=65535 Len=0"
"279","1.430291839","172.217.166.68","10.0.2.15","TCP","1476","443  >  52340 [ACK] Seq=135831 Ack=924 Win=65535 Len=1420 [TCP segment of a reassembled PDU]"
"280","1.430302454","172.217.166.68","10.0.2.15","TLSv1.2","1476","Application Data [TCP segment of a reassembled PDU]"
"281","1.430309718","172.217.166.68","10.0.2.15","TLSv1.2","801","Application Data, Application Data"
"282","1.433603433","127.0.0.1","127.0.0.53","DNS","75","Standard query 0x17ee A id.google.com"
"283","1.433608741","10.0.2.15","172.217.166.68","TCP","56","52340  >  443 [ACK] Seq=924 Ack=139416 Win=65535 Len=0"
"284","1.433675509","127.0.0.1","127.0.0.53","DNS","75","Standard query 0x5929 AAAA id.google.com"
"285","1.433940347","10.0.2.15","1.0.0.1","DNS","86","Standard query 0x15f8 A id.google.com OPT"
"286","1.434120817","10.0.2.15","1.0.0.1","DNS","86","Standard query 0x7bd5 AAAA id.google.com OPT"
"287","1.441780170","172.217.166.68","10.0.2.15","TCP","1476","443  >  52340 [ACK] Seq=139416 Ack=924 Win=65535 Len=1420 [TCP segment of a reassembled PDU]"
"288","1.441832411","172.217.166.68","10.0.2.15","TLSv1.2","66","Application Data"
"289","1.441850850","10.0.2.15","172.217.166.68","TCP","56","52340  >  443 [ACK] Seq=924 Ack=140846 Win=65535 Len=0"
"290","1.442092500","172.217.166.68","10.0.2.15","TCP","1476","443  >  52340 [ACK] Seq=140846 Ack=924 Win=65535 Len=1420 [TCP segment of a reassembled PDU]"
"291","1.442114291","172.217.166.68","10.0.2.15","TLSv1.2","1476","Application Data [TCP segment of a reassembled PDU]"
"292","1.442125186","10.0.2.15","172.217.166.68","TCP","56","52340  >  443 [ACK] Seq=924 Ack=143686 Win=65535 Len=0"
"293","1.442158710","172.217.166.68","10.0.2.15","TLSv1.2","1476","Application Data [TCP segment of a reassembled PDU]"
"294","1.442169605","172.217.166.68","10.0.2.15","TLSv1.2","1476","Application Data [TCP segment of a reassembled PDU]"
"295","1.442182177","10.0.2.15","172.217.166.68","TCP","56","52340  >  443 [ACK] Seq=924 Ack=146526 Win=65535 Len=0"
"296","1.442212069","172.217.166.68","10.0.2.15","TLSv1.2","1476","Application Data [TCP segment of a reassembled PDU]"
"297","1.442223802","172.217.166.68","10.0.2.15","TLSv1.2","1476","Application Data [TCP segment of a reassembled PDU]"
"298","1.442234138","10.0.2.15","172.217.166.68","TCP","56","52340  >  443 [ACK] Seq=924 Ack=149366 Win=65535 Len=0"
"299","1.442275205","172.217.166.68","10.0.2.15","TLSv1.2","116","Application Data"
"300","1.442286659","1.0.0.1","10.0.2.15","DNS","121","Standard query response 0x15f8 A id.google.com CNAME id.l.google.com A 172.217.167.163 OPT"
"301","1.442320183","172.217.166.68","10.0.2.15","TCP","1476","443  >  52340 [ACK] Seq=149426 Ack=924 Win=65535 Len=1420 [TCP segment of a reassembled PDU]"
"302","1.442332196","172.217.166.68","10.0.2.15","TLSv1.2","1476","Application Data [TCP segment of a reassembled PDU]"
"303","1.442342253","172.217.166.68","10.0.2.15","TLSv1.2","76","Application Data"
"304","1.442446456","10.0.2.15","172.217.166.68","TCP","56","52340  >  443 [ACK] Seq=924 Ack=152286 Win=65535 Len=0"
"305","1.442754596","172.217.166.68","10.0.2.15","TCP","1476","443  >  52340 [ACK] Seq=152286 Ack=924 Win=65535 Len=1420 [TCP segment of a reassembled PDU]"
"306","1.442768005","172.217.166.68","10.0.2.15","TLSv1.2","1476","Application Data [TCP segment of a reassembled PDU]"
"307","1.442776945","172.217.166.68","10.0.2.15","TLSv1.2","76","Application Data"
"308","1.442782812","172.217.166.68","10.0.2.15","TLSv1.2","915","Application Data"
"309","1.442804881","10.0.2.15","172.217.166.68","TCP","56","52340  >  443 [ACK] Seq=924 Ack=156005 Win=65535 Len=0"
"310","1.442724704","127.0.0.53","127.0.0.1","DNS","110","Standard query response 0x17ee A id.google.com CNAME id.l.google.com A 172.217.167.163"
"311","1.449148984","1.0.0.1","10.0.2.15","DNS","133","Standard query response 0x7bd5 AAAA id.google.com CNAME id.l.google.com AAAA 2a00:1450:400c:c0b::5e OPT"
"312","1.449469136","127.0.0.53","127.0.0.1","DNS","122","Standard query response 0x5929 AAAA id.google.com CNAME id.l.google.com AAAA 2a00:1450:400c:c0b::5e"
"313","1.449923384","10.0.2.15","172.217.167.163","TCP","76","33422  >  443 [SYN] Seq=0 Win=29200 Len=0 MSS=1460 SACK_PERM=1 TSval=107852264 TSecr=0 WS=128"
"314","1.452302737","172.217.166.68","10.0.2.15","TCP","1476","443  >  52340 [ACK] Seq=156005 Ack=924 Win=65535 Len=1420 [TCP segment of a reassembled PDU]"
"315","1.452332349","172.217.166.68","10.0.2.15","TLSv1.2","66","Application Data"
"316","1.452346876","10.0.2.15","172.217.166.68","TCP","56","52340  >  443 [ACK] Seq=924 Ack=157435 Win=65535 Len=0"
"317","1.452756984","172.217.166.68","10.0.2.15","TCP","1476","443  >  52340 [ACK] Seq=157435 Ack=924 Win=65535 Len=1420 [TCP segment of a reassembled PDU]"
"318","1.452781010","172.217.166.68","10.0.2.15","TLSv1.2","1476","Application Data [TCP segment of a reassembled PDU]"
"319","1.452794419","10.0.2.15","172.217.166.68","TCP","56","52340  >  443 [ACK] Seq=924 Ack=160275 Win=65535 Len=0"
"320","1.452821238","172.217.166.68","10.0.2.15","TLSv1.2","76","Application Data"
"321","1.453005619","10.0.2.15","172.217.166.68","TCP","56","52340  >  443 [ACK] Seq=924 Ack=160295 Win=65535 Len=0"
"322","1.453089429","172.217.166.68","10.0.2.15","TCP","1476","443  >  52340 [ACK] Seq=160295 Ack=924 Win=65535 Len=1420 [TCP segment of a reassembled PDU]"
"323","1.453096972","172.217.166.68","10.0.2.15","TLSv1.2","1476","Application Data [TCP segment of a reassembled PDU]"
"324","1.453102000","172.217.166.68","10.0.2.15","TLSv1.2","76","Application Data"
"325","1.453178826","10.0.2.15","172.217.166.68","TCP","56","52340  >  443 [ACK] Seq=924 Ack=163135 Win=65535 Len=0"
"326","1.453306775","10.0.2.15","172.217.166.68","TCP","56","52340  >  443 [ACK] Seq=924 Ack=163155 Win=65535 Len=0"
"327","1.453386673","172.217.166.68","10.0.2.15","TCP","1476","443  >  52340 [ACK] Seq=163155 Ack=924 Win=65535 Len=1420 [TCP segment of a reassembled PDU]"
"328","1.453393937","172.217.166.68","10.0.2.15","TLSv1.2","66","Application Data"
"329","1.453420197","10.0.2.15","172.217.166.68","TCP","56","52340  >  443 [ACK] Seq=924 Ack=164585 Win=65535 Len=0"
"330","1.453644807","172.217.166.68","10.0.2.15","TCP","1476","443  >  52340 [ACK] Seq=164585 Ack=924 Win=65535 Len=1420 [TCP segment of a reassembled PDU]"
"331","1.453657657","172.217.166.68","10.0.2.15","TLSv1.2","1476","Application Data [TCP segment of a reassembled PDU]"
"332","1.453673302","10.0.2.15","172.217.166.68","TCP","56","52340  >  443 [ACK] Seq=924 Ack=167425 Win=65535 Len=0"
"333","1.453695092","172.217.166.68","10.0.2.15","TLSv1.2","76","Application Data"
"334","1.453823600","10.0.2.15","172.217.166.68","TCP","56","52340  >  443 [ACK] Seq=924 Ack=167445 Win=65535 Len=0"
"335","1.453888134","172.217.166.68","10.0.2.15","TCP","1476","443  >  52340 [ACK] Seq=167445 Ack=924 Win=65535 Len=1420 [TCP segment of a reassembled PDU]"
"336","1.453894838","172.217.166.68","10.0.2.15","TLSv1.2","66","Application Data"
"337","1.453950711","10.0.2.15","172.217.166.68","TCP","56","52340  >  443 [ACK] Seq=924 Ack=168875 Win=65535 Len=0"
"338","1.454153810","172.217.166.68","10.0.2.15","TCP","1476","443  >  52340 [ACK] Seq=168875 Ack=924 Win=65535 Len=1420 [TCP segment of a reassembled PDU]"
"339","1.454165543","172.217.166.68","10.0.2.15","TLSv1.2","66","Application Data"
"340","1.454175042","10.0.2.15","172.217.166.68","TCP","56","52340  >  443 [ACK] Seq=924 Ack=170305 Win=65535 Len=0"
"341","1.454365569","172.217.166.68","10.0.2.15","TCP","1476","443  >  52340 [ACK] Seq=170305 Ack=924 Win=65535 Len=1420 [TCP segment of a reassembled PDU]"
"342","1.454371994","172.217.166.68","10.0.2.15","TLSv1.2","1077","Application Data, Application Data"
